{
    "$schema": "http://json-schema.org/draft-04/schema", 
    "required": [
        "networks", 
        "continent", 
        "id", 
        "name"
    ], 
    "type": "object", 
    "properties": {
        "id": {
            "type": "string"
        }, 
        "networks": {
            "required": [
                "IPv4", 
                "IPv6"
            ], 
            "type": "object", 
            "properties": {
                "IPv4": {
                    "items": {
                        "type": "string"
                    }, 
                    "type": "array"
                }, 
                "IPv6": {
                    "items": {
                        "type": "string"
                    }, 
                    "type": "array"
                }
            }
        }, 
        "name": {
            "type": "string"
        }, 
        "continent": {
            "required": [
                "name", 
                "id"
            ], 
            "type": "object", 
            "properties": {
                "name": {
                    "type": "string"
                }, 
                "id": {
                    "type": "string"
                }
            }
        }
    }
}
